{
  "schema_version": "1",
  "id": "synthetic-003-retraction",
  "content_path": "content/news/2026/S1-synth-2026-08-08-003/content.ja.md",
  "status": "active",
  "reason": "synthetic retraction route regression",
  "requested_at": "2026-08-09T10:33:00Z",
  "requested_by": "human-reviewer",
  "resolved_at": null
}
